{
  "report_id": "REPORT-20260710-INNOVATIVE-DRUG",
  "title": "创新药产业研究报告",
  "research_question": "创新药产业链中研发、临床、审评、商业化和支付环节的关键约束如何被证据验证？",
  "methodology_refs": [
    "supply-chain-chokepoint",
    "industry-lifecycle",
    "evidence-chain"
  ],
  "evidence_cards": {
    "EV-20260710-DRG1": {
      "evidence_id": "EV-20260710-DRG1",
      "title": "靶点发现到临床转化存在长周期约束",
      "category": "industry",
      "source": "AIRS 示例证据库",
      "source_type": "industry_report",
      "url": "internal://airs/examples/innovative-drug/evidence-1",
      "publication_time": "2026-07-10T00:00:00+08:00",
      "collection_time": "2026-07-10T10:00:00+08:00",
      "confidence": 0.72,
      "evidence_level": "B",
      "supports": [
        {
          "claim_id": "CL-DRG-CLINICAL",
          "statement": "临床转化和入组效率是创新药研发路径的重要约束。",
          "strength": "strong"
        }
      ],
      "refutes": [
        {
          "claim_id": "CL-DRG-FAST-TRACK",
          "statement": "突破性疗法和优先审评可能缩短部分项目周期。",
          "strength": "medium"
        }
      ],
      "missing_evidence": [
        "需要补充具体适应症入组速度和终点达成数据。"
      ],
      "weight": 0.34,
      "traceability": {
        "collected_by": "Research Agent",
        "collection_method": "示例化证据卡整理",
        "source_locator": "examples/knowledge-graph/innovative-drug-industry-chain.json",
        "transformations": [
          "结构化为 Evidence Card"
        ]
      },
      "version": "0.1.0"
    },
    "EV-20260710-DRG2": {
      "evidence_id": "EV-20260710-DRG2",
      "title": "CMC 与放大生产影响商业化进度",
      "category": "supply_chain",
      "source": "AIRS 示例证据库",
      "source_type": "expert_opinion",
      "url": "internal://airs/examples/innovative-drug/evidence-2",
      "publication_time": "2026-07-10T00:00:00+08:00",
      "collection_time": "2026-07-10T10:10:00+08:00",
      "confidence": 0.7,
      "evidence_level": "B",
      "supports": [
        {
          "claim_id": "CL-DRG-CMC",
          "statement": "CMC、质量体系和放大生产会影响创新药上市与供应稳定性。",
          "strength": "strong"
        }
      ],
      "refutes": [
        {
          "claim_id": "CL-DRG-CDMO",
          "statement": "成熟 CDMO 资源可部分缓解生产放大瓶颈。",
          "strength": "medium"
        }
      ],
      "missing_evidence": [
        "需要补充具体产品批次成功率、质量偏差和产能利用率。"
      ],
      "weight": 0.33,
      "traceability": {
        "collected_by": "Research Agent",
        "collection_method": "示例化证据卡整理",
        "source_locator": "examples/knowledge-graph/innovative-drug-industry-chain.json",
        "transformations": [
          "结构化为 Evidence Card"
        ]
      },
      "version": "0.1.0"
    },
    "EV-20260710-DRG3": {
      "evidence_id": "EV-20260710-DRG3",
      "title": "医保准入与商业化放量不确定性",
      "category": "counter_evidence",
      "source": "AIRS 示例证据库",
      "source_type": "government_policy",
      "url": "internal://airs/examples/innovative-drug/evidence-3",
      "publication_time": "2026-07-10T00:00:00+08:00",
      "collection_time": "2026-07-10T10:20:00+08:00",
      "confidence": 0.68,
      "evidence_level": "B",
      "supports": [
        {
          "claim_id": "CL-DRG-ACCESS",
          "statement": "医保准入、支付能力和医生教育会影响商业化兑现。",
          "strength": "medium"
        }
      ],
      "refutes": [
        {
          "claim_id": "CL-DRG-RD-ONLY",
          "statement": "仅用研发进度解释产业链约束是不完整的。",
          "strength": "medium"
        }
      ],
      "missing_evidence": [
        "需要补充医保谈判结果、院内准入和真实世界使用数据。"
      ],
      "weight": 0.33,
      "traceability": {
        "collected_by": "Research Agent",
        "collection_method": "示例化证据卡整理",
        "source_locator": "examples/knowledge-graph/innovative-drug-industry-chain.json",
        "transformations": [
          "结构化为 Evidence Card"
        ]
      },
      "version": "0.1.0"
    }
  },
  "knowledge_graph_summary": {
    "graph_id": "KG-20260710-INNOVATIVE-DRUG",
    "title": "创新药产业链知识图谱",
    "node_count": 6,
    "edge_count": 5,
    "path_count": 1,
    "chokepoint_count": 1,
    "top_chokepoint": {
      "node_id": "N-DRG-CLINICAL",
      "label": "临床试验入组与终点验证",
      "chokepoint_score": 0.864,
      "risk_level": "HIGH",
      "drivers": [
        "供给稀缺",
        "替代难度高",
        "扩产难度高",
        "认证周期长",
        "证据质量较高"
      ],
      "evidence_refs": [
        "EV-20260710-DRG1",
        "EV-20260710-DRG3"
      ],
      "counter_evidence_refs": [
        "EV-20260710-DRG1",
        "EV-20260710-DRG2"
      ],
      "missing_evidence": [
        "需要补充分适应症入组效率、退出率和终点事件数。"
      ]
    },
    "methodology_refs": [
      "supply-chain-chokepoint",
      "industry-lifecycle",
      "evidence-chain"
    ],
    "evidence_refs": [
      "EV-20260710-DRG1",
      "EV-20260710-DRG2",
      "EV-20260710-DRG3"
    ]
  },
  "score_summary": {
    "scorecard_id": "SCORECARD-INNOVATIVE-DRUG-REPORT-001",
    "overall_score": 80,
    "overall_grade": "B",
    "confidence_score": 75,
    "quality_gate": "PASS",
    "methodology_refs": [
      "supply-chain-chokepoint",
      "industry-lifecycle",
      "evidence-chain"
    ],
    "evidence_chain_refs": [
      "EV-20260710-DRG1",
      "EV-20260710-DRG2",
      "EV-20260710-DRG3"
    ],
    "dimensions": {
      "Evidence Score": 81,
      "Knowledge Graph Score": 80,
      "Report Score": 85,
      "Risk Score": 74,
      "Counter Evidence Score": 78
    },
    "disclaimer": "仅供研究参考，不构成投资建议"
  },
  "sections": [
    {
      "section_id": "metadata",
      "title": "报告元数据",
      "body": "- Report ID：`REPORT-20260710-INNOVATIVE-DRUG`\n- 研究主题：创新药产业研究报告\n- Prompt 引用：`prompts/report/generation.md`\n- Skill 引用：`skills/report/report-skill.md`\n- Evidence 数量：3\n- KG 引用：`KG-20260710-INNOVATIVE-DRUG`\n- Scorecard 引用：`SCORECARD-INNOVATIVE-DRUG-REPORT-001`",
      "evidence_refs": [
        "EV-20260710-DRG1",
        "EV-20260710-DRG2",
        "EV-20260710-DRG3"
      ],
      "kg_refs": [
        "KG-20260710-INNOVATIVE-DRUG"
      ],
      "score_refs": [
        "SCORECARD-INNOVATIVE-DRUG-REPORT-001"
      ]
    },
    {
      "section_id": "scope",
      "title": "研究问题与范围",
      "body": "创新药产业链中研发、临床、审评、商业化和支付环节的关键约束如何被证据验证？",
      "evidence_refs": [],
      "kg_refs": [],
      "score_refs": []
    },
    {
      "section_id": "methodology",
      "title": "方法论引用",
      "body": "- `supply-chain-chokepoint`：沿用 M2 方法论，不在报告层重写研究规则。\n- `industry-lifecycle`：沿用 M2 方法论，不在报告层重写研究规则。\n- `evidence-chain`：沿用 M2 方法论，不在报告层重写研究规则。",
      "evidence_refs": [],
      "kg_refs": [],
      "score_refs": []
    },
    {
      "section_id": "thesis",
      "title": "核心观点",
      "body": "创新药产业研究应把研发管线、临床成功率、审评政策、商业化能力和支付约束放在同一证据链中评估。 该观点至少引用 [EV-20260710-DRG1] 靶点发现到临床转化存在长周期约束（来源：AIRS 示例证据库；等级：B；置信度：0.72），并由 KG 卡点 `N-DRG-CLINICAL` 与 Scorecard `SCORECARD-INNOVATIVE-DRUG-REPORT-001` 共同约束。",
      "evidence_refs": [
        "EV-20260710-DRG1",
        "EV-20260710-DRG2",
        "EV-20260710-DRG3"
      ],
      "kg_refs": [
        "KG-20260710-INNOVATIVE-DRUG"
      ],
      "score_refs": [
        "SCORECARD-INNOVATIVE-DRUG-REPORT-001"
      ]
    },
    {
      "section_id": "evidence-citations",
      "title": "Evidence 引用表",
      "body": "| Evidence ID | 标题 | 类别 | 来源类型 | 等级 | 权重 | 支持命题 | 反方或限制 |\n|---|---|---|---|---|---:|---|---|\n| EV-20260710-DRG1 | 靶点发现到临床转化存在长周期约束 | industry | industry_report | B | 0.34 | 临床转化和入组效率是创新药研发路径的重要约束。 | 突破性疗法和优先审评可能缩短部分项目周期。 |\n| EV-20260710-DRG2 | CMC 与放大生产影响商业化进度 | supply_chain | expert_opinion | B | 0.33 | CMC、质量体系和放大生产会影响创新药上市与供应稳定性。 | 成熟 CDMO 资源可部分缓解生产放大瓶颈。 |\n| EV-20260710-DRG3 | 医保准入与商业化放量不确定性 | counter_evidence | government_policy | B | 0.33 | 医保准入、支付能力和医生教育会影响商业化兑现。 | 仅用研发进度解释产业链约束是不完整的。 |",
      "evidence_refs": [
        "EV-20260710-DRG1",
        "EV-20260710-DRG2",
        "EV-20260710-DRG3"
      ],
      "kg_refs": [],
      "score_refs": []
    },
    {
      "section_id": "evidence-chain",
      "title": "Evidence Chain 汇总",
      "body": "- [EV-20260710-DRG1] 靶点发现到临床转化存在长周期约束（来源：AIRS 示例证据库；等级：B；置信度：0.72）\n- [EV-20260710-DRG2] CMC 与放大生产影响商业化进度（来源：AIRS 示例证据库；等级：B；置信度：0.7）\n- [EV-20260710-DRG3] 医保准入与商业化放量不确定性（来源：AIRS 示例证据库；等级：B；置信度：0.68）",
      "evidence_refs": [
        "EV-20260710-DRG1",
        "EV-20260710-DRG2",
        "EV-20260710-DRG3"
      ],
      "kg_refs": [],
      "score_refs": [
        "SCORECARD-INNOVATIVE-DRUG-REPORT-001"
      ]
    },
    {
      "section_id": "kg-summary",
      "title": "Knowledge Graph 汇总",
      "body": "- KG ID：`KG-20260710-INNOVATIVE-DRUG`\n- 图谱标题：创新药产业链知识图谱\n- 节点 / 关系 / 路径：6 / 5 / 1\n- Top Chokepoint：临床试验入组与终点验证（节点：`N-DRG-CLINICAL`；分数：0.864；风险：HIGH）\n- 卡点驱动：供给稀缺；替代难度高；扩产难度高；认证周期长；证据质量较高\n- KG Evidence Refs：`EV-20260710-DRG1`, `EV-20260710-DRG2`, `EV-20260710-DRG3`",
      "evidence_refs": [
        "EV-20260710-DRG1",
        "EV-20260710-DRG2",
        "EV-20260710-DRG3"
      ],
      "kg_refs": [
        "KG-20260710-INNOVATIVE-DRUG"
      ],
      "score_refs": []
    },
    {
      "section_id": "score-summary",
      "title": "Score Summary",
      "body": "- Scorecard ID：`SCORECARD-INNOVATIVE-DRUG-REPORT-001`\n- Overall Score / Grade：80 / B\n- Confidence Score：75\n- Quality Gate：`PASS`\n- 维度分：Evidence Score: 81；Knowledge Graph Score: 80；Report Score: 85；Risk Score: 74；Counter Evidence Score: 78\n- Score Evidence Refs：`EV-20260710-DRG1`, `EV-20260710-DRG2`, `EV-20260710-DRG3`\n- Score Disclaimer：仅供研究参考，不构成投资建议",
      "evidence_refs": [
        "EV-20260710-DRG1",
        "EV-20260710-DRG2",
        "EV-20260710-DRG3"
      ],
      "kg_refs": [],
      "score_refs": [
        "SCORECARD-INNOVATIVE-DRUG-REPORT-001"
      ]
    },
    {
      "section_id": "counterarguments",
      "title": "反方观点",
      "body": "- 临床阶段数据不能简单外推为获批和商业化成功。\n- 医保控费和医院准入可能压缩创新药商业化空间。\n- 同靶点竞争、专利到期和国际化不确定性会削弱产业链判断。",
      "evidence_refs": [
        "EV-20260710-DRG1",
        "EV-20260710-DRG2",
        "EV-20260710-DRG3"
      ],
      "kg_refs": [
        "KG-20260710-INNOVATIVE-DRUG"
      ],
      "score_refs": []
    },
    {